{
  "$schema": "http://json-schema.org/draft-07/schema#",
  "title": "Transcript Chunk",
  "description": "A chunk of transcribed text from the speech-to-text component",
  "type": "object",
  "required": ["timestamp", "text", "session_id", "chunk_id"],
  "properties": {
    "timestamp": {
      "type": "string",
      "format": "date-time",
      "description": "ISO-8601 timestamp when this chunk was created"
    },
    "text": {
      "type": "string",
      "description": "The transcribed text content",
      "minLength": 1
    },
    "session_id": {
      "type": "string",
      "description": "Unique identifier for this transcription session"
    },
    "chunk_id": {
      "type": "integer",
      "description": "Sequential ID for this chunk within the session",
      "minimum": 0
    },
    "confidence": {
      "type": "number",
      "description": "Optional confidence score from STT service",
      "minimum": 0,
      "maximum": 1
    },
    "metadata": {
      "type": "object",
      "description": "Optional additional metadata",
      "properties": {
        "duration_ms": {
          "type": "integer",
          "description": "Duration of this audio chunk in milliseconds"
        },
        "speaker_id": {
          "type": "string",
          "description": "Optional speaker identification (future feature)"
        }
      }
    }
  }
}
